{
  "schema_version": "1.0",
  "skill_version": "0.1.0",
  "reviewed_at": "2026-10-08T10:28:28.247Z",
  "scope": {
    "repository": "/tmp/cloudflare-cost-safety-forward/app-b",
    "commit": null,
    "review_mode": "full",
    "analysis_scope": "full_local_call_closure_including_configuration",
    "changed_files": [],
    "files": [
      {
        "path": "main.js",
        "sha256": "13c24f362f92dac4b33a09ef8414dad86f0374bd2dbe6b1729dd1cb4cbbdf769",
        "bytes": 153
      },
      {
        "path": "package-lock.json",
        "sha256": "97a123aa68ccb918c140b085cc6a52aac04955c3ecdba02a6d34ef725e5a1f5d",
        "bytes": 143
      },
      {
        "path": "producer.js",
        "sha256": "09e974a2d6cfad0286d055dbd87a08436c42714e86caffa35064bef408b172b7",
        "bytes": 101
      },
      {
        "path": "wrangler.jsonc",
        "sha256": "9a355797f0ce665e5805b6a2fb48007c71ea299308d95ae31a7991711996e9a7",
        "bytes": 427
      }
    ],
    "cloud_account_accessed": false
  },
  "activation": {
    "trigger": true,
    "activation": "explicit_early_preflight",
    "status": "resolved"
  },
  "deployment_identity": {
    "schema_version": "1.0",
    "source_snapshot_digest": "f72ed366268e8b964ffe1af381fed72ab6cf4b3acbd41e7f025dbf4aa52e861c",
    "commit": null,
    "artifact_digest": "13c24f362f92dac4b33a09ef8414dad86f0374bd2dbe6b1729dd1cb4cbbdf769",
    "artifact_path": "main.js",
    "effective_config_digest": "81017a456689d4c72ae351c5a72cb1ae1a78e25bbbb9f55425fc118387f93c3f",
    "config_path": "wrangler.jsonc",
    "target": {
      "account_id": "aaaaaaaaaaaaaaaaaaaaaaaaaaaaaaaa",
      "application": "app-b",
      "environment": "production",
      "action": "deploy",
      "candidate_version": null
    },
    "official_skills_lock_digest": "296f2a111e4c5cb6fd6f6608ad95d3bef13f998ed4ef210b7302edf12beb5d12",
    "policy_digest": "2312ecff40b38a74d728cf6a5c4b4429cbdd3511b65cfb78fd84907bd19bb856",
    "rules_digest": "6119ce77c6da4cbee3162e4b9960f576479a389c65ea6260ca77fe8ff3129c92",
    "tool_digest": "78569fd83425ce443a71e3f84f65da95832db2bb311fd6f94b08126a9ab0ffe6",
    "toolchain": {
      "node": "v24.11.1",
      "typescript": "5.9.3",
      "wrangler": "4.148.0",
      "lockfiles": [
        "package-lock.json"
      ]
    },
    "migration_digest": "4f53cda18c2baa0c0354bb5f9a3ecbe5ed12ab4d8e11ba873c2f11161202b945",
    "builder": "synthetic-direct-js@1",
    "digest": "01e0337ef6348ad7b48bbbdc082bf4abfc195f56d3f9ec91a1f7f610089f0c52"
  },
  "inventory": {
    "application": "app-b",
    "toolchain": "wrangler",
    "tool_versions": {
      "node": "v24.11.1",
      "typescript": "5.9.3",
      "wrangler": "4.148.0",
      "lockfiles": [
        "package-lock.json"
      ]
    },
    "compatibility_date": "2026-10-08",
    "compatibility_flags": [],
    "has_do": false,
    "static_only": false,
    "bindings": [
      {
        "kind": "queue_producer",
        "name": "JOBS",
        "status": "declared",
        "evidence": {
          "path": "wrangler.jsonc",
          "start_line": 1
        },
        "config": {
          "binding": "JOBS",
          "queue": "jobs"
        },
        "remote": false
      },
      {
        "kind": "queue_consumer",
        "name": "jobs",
        "status": "declared",
        "evidence": {
          "path": "wrangler.jsonc",
          "start_line": 1
        },
        "config": {
          "queue": "jobs",
          "max_retries": 0
        },
        "remote": false
      }
    ],
    "entry_points": [
      {
        "name": "queue",
        "type": "queue",
        "status": "declared",
        "location": {
          "path": "main.js",
          "start_line": 1,
          "end_line": 1
        }
      }
    ],
    "environments": [],
    "account_state": "unknown_not_accessed",
    "migration_files": []
  },
  "execution_graph": {
    "nodes": [
      {
        "id": "main.js#module",
        "kind": "logical_task",
        "name": "module",
        "entry_type": null,
        "status": "declared",
        "location": {
          "path": "main.js",
          "start_line": 1,
          "end_line": 1
        }
      },
      {
        "id": "main.js#queue@55",
        "kind": "entry",
        "name": "queue",
        "entry_type": "queue",
        "status": "declared",
        "location": {
          "path": "main.js",
          "start_line": 1,
          "end_line": 1
        }
      },
      {
        "id": "producer.js#module",
        "kind": "logical_task",
        "name": "module",
        "entry_type": null,
        "status": "declared",
        "location": {
          "path": "producer.js",
          "start_line": 1,
          "end_line": 1
        }
      },
      {
        "id": "producer.js#enqueue@0",
        "kind": "logical_task",
        "name": "enqueue",
        "entry_type": null,
        "status": "declared",
        "location": {
          "path": "producer.js",
          "start_line": 1,
          "end_line": 1
        }
      },
      {
        "id": "resource:JOBS",
        "kind": "resource",
        "product": "queue_producer",
        "status": "declared",
        "location": {
          "path": "wrangler.jsonc",
          "start_line": 1
        }
      },
      {
        "id": "resource:jobs",
        "kind": "resource",
        "product": "queue_consumer",
        "status": "declared",
        "location": {
          "path": "wrangler.jsonc",
          "start_line": 1
        }
      },
      {
        "id": "op:producer.js:45",
        "kind": "billable_operation",
        "operation": "send",
        "resource": "JOBS",
        "status": "declared",
        "location": {
          "path": "producer.js",
          "start_line": 1,
          "end_line": 1
        }
      }
    ],
    "edges": [
      {
        "from": "main.js#queue@55",
        "to": "producer.js#enqueue@0",
        "kind": "local_call",
        "location": {
          "path": "main.js",
          "start_line": 1,
          "end_line": 1
        }
      },
      {
        "from": "main.js#module",
        "to": "producer.js#module",
        "kind": "module_initialization",
        "location": {
          "path": "main.js",
          "start_line": 1,
          "end_line": 1
        }
      },
      {
        "from": "main.js#module",
        "to": "producer.js#module",
        "kind": "module_initialization",
        "location": {
          "path": "main.js",
          "start_line": 1,
          "end_line": 1
        }
      },
      {
        "from": "producer.js#enqueue@0",
        "to": "op:producer.js:45",
        "kind": "send",
        "location": {
          "path": "producer.js",
          "start_line": 1,
          "end_line": 1
        }
      },
      {
        "from": "op:producer.js:45",
        "to": "resource:JOBS",
        "kind": "resource_access",
        "location": {
          "path": "producer.js",
          "start_line": 1,
          "end_line": 1
        }
      }
    ]
  },
  "official_skills": [
    {
      "name": "workers-best-practices",
      "required": true,
      "applies": true,
      "reason": "Cloudflare application preflight baseline",
      "upstream": "https://github.com/cloudflare/skills",
      "revision": "41e0d19858946d18af9ee2c2feebbe2e11d829ff",
      "resolved_path": "/tmp/cloudflare-cost-safety-forward-tool/vendor/workers-best-practices",
      "content_digest": "131ab0c3d228c1c827bfc1ece886dd512ce92d3933e57e539b3a4a2c0147ed56",
      "loaded_references": [
        {
          "path": "references/configuration.md",
          "sha256": "cdb5c9cd5168231373523332c0e7a5cf8811dc244c48298823e3ccc5eb7157c1"
        },
        {
          "path": "references/platform-apis.md",
          "sha256": "9ca9f5a7a82f92de45d310f5e2ee05aa464ddb7a63a737529caa17fff3660f28"
        },
        {
          "path": "references/runtime-patterns.md",
          "sha256": "704ce8d4ff62c7655eb1d15f804ad566ed2012d11c2086e0d94bd3addb4d2c07"
        }
      ],
      "load_status": "reviewed",
      "review_status": "reviewed",
      "findings": [],
      "evidence": [
        {
          "path": "vendor/workers-best-practices/SKILL.md",
          "sha256": "8ae8c6e7359171ba6a1688503850fa05ce47199c4e288343bf55b5e277351bae",
          "operation": "read"
        },
        {
          "path": "vendor/workers-best-practices/references/configuration.md",
          "sha256": "cdb5c9cd5168231373523332c0e7a5cf8811dc244c48298823e3ccc5eb7157c1",
          "operation": "read"
        },
        {
          "path": "vendor/workers-best-practices/references/platform-apis.md",
          "sha256": "9ca9f5a7a82f92de45d310f5e2ee05aa464ddb7a63a737529caa17fff3660f28",
          "operation": "read"
        },
        {
          "path": "vendor/workers-best-practices/references/runtime-patterns.md",
          "sha256": "704ce8d4ff62c7655eb1d15f804ad566ed2012d11c2086e0d94bd3addb4d2c07",
          "operation": "read"
        },
        {
          "kind": "semantic_review",
          "reason": "Actually read entry plus configuration, platform-apis and runtime-patterns content from the pinned context. Logs and traces are enabled and date is 2026-10-08; inspected module/class binding access, platform import, async lifetimes, serialization and state. No Node built-ins are imported, so absent nodejs_compat alone is not a defect. JS fixtures contain no hand-written Env type. Application runtime checks remain unexecuted and no live observability cost/coverage is claimed.",
          "evidence": [
            {
              "path": "wrangler.jsonc",
              "start_line": 1
            },
            {
              "path": "main.js",
              "start_line": 1
            }
          ]
        }
      ]
    },
    {
      "name": "wrangler",
      "required": true,
      "applies": true,
      "reason": "Wrangler effective configuration or release path",
      "upstream": "https://github.com/cloudflare/skills",